{"$schema":"https://json-schema.org/draft/2020-12/schema","title":"JiuwenSwarm v4 report","type":"object","required":["abstract","method","experiment_setting","results","limitations","conclusion","citation_mapping","unsupported_claims"],"properties":{"abstract":{"type":"string"},"method":{"type":"string"},"experiment_setting":{"type":"string"},"results":{"type":"string"},"limitations":{"type":"string"},"conclusion":{"type":"string"},"citation_mapping":{"type":"array"},"unsupported_claims":{"type":"array","items":{"type":"string"}}},"additionalProperties":false}