{
  "abstract": "本报告检验程序级证据护栏能否提高 Agent 执行报告的证据一致性。三个 arm 均完成且 return_code=0，task_success_rate 均为 1.0。no-rail 的 UCR=0.5556（5/9），prompt-only 与 full-rail 的 UCR=0.0（0/4）。full-rail 的 rail.enabled=true、attempts=1、accepted=true。UCR 仅为 process_evidence_only 指标，不解释为任务质量或正确性。",
  "method": "在相同任务集上运行 no-rail、prompt-only、full-rail 三个 arm，记录 return_code、task_success_rate、rail 状态与每个 operation_id 的 decision.status/reason。UCR 分母为全部完成声明，分子为无匹配证据的完成声明。citation_allowed=false，所有结论仅引用本次实验记录。",
  "experiment_setting": "arm：no-rail（rail.enabled=false，attempts=0）、prompt-only（rail.enabled=false，attempts=0）、full-rail（rail.enabled=true，attempts=1，accepted=true）。三个 arm 均 status=completed、return_code=0。CFR 与 NFR 在 UCR 场景中均为 not_measured_in_ucr_scenario。",
  "results": "no-rail：UCR=0.5556（5/9），supported=4，unexecuted=5，task_success_rate=1.0。prompt-only：UCR=0.0（0/4），supported=4，unexecuted=0，task_success_rate=1.0。full-rail：UCR=0.0（0/4），supported=4，unexecuted=0，task_success_rate=1.0，rail.enabled=true，attempts=1，accepted=true。所有 supported 决策的 reason 均为 matching_successful_evidence。",
  "limitations": "UCR 仅为 process_evidence_only 指标，不解释为任务质量或正确性。prompt-only 与 full-rail 的 UCR=0.0 可能因任务集不同而不可直接比较。no-rail 的 5 个 unexecuted 是否应计入无证据完成声明尚待人工确认。CFR 与 NFR 未在 UCR 场景中测量。citation_allowed=false，材料不得作为正式引用。",
  "conclusion": "在本次实验记录范围内，full-rail 的 UCR=0.0 低于 no-rail 的 0.5556，与 prompt-only 的 0.0 相同；full-rail 的 rail.enabled=true 且 accepted=true。该结果与假设方向一致，但因任务集差异与 UCR 指标限制，不能据此断言程序级护栏的因果效果。",
  "citation_mapping": [{"claim_id":"claim-018","source_id":"crossref:10.2139/ssrn.6506600"},{"claim_id":"claim-019","source_id":"crossref:10.37547/tajet/volume08issue03-12"},{"claim_id":"claim-020","source_id":"crossref:10.4018/978-1-60566-618-1.ch002"}],
  "unsupported_claims": [
    "claim-002",
    "claim-003",
    "claim-005",
    "claim-007",
    "claim-009"
  ]
}
