{
  "abstract": "本报告检验程序级证据护栏能否提高 Agent 执行报告的证据一致性。基于已完成的 no-rail、prompt-only、full-rail 三个 arm 的 UCR 指标，no-rail 的 UCR 为 0.5556（5/9），prompt-only 与 full-rail 均为 0.0（0/4）。full-rail 的 rail.enabled=true、attempts=1、accepted=true。三个 arm 的 task_success_rate 均为 1.0。证据仅支持有限结论：full-rail 与 prompt-only 均未出现无证据完成声明，且 full-rail 的 UCR 低于 no-rail。",
  "method": "复用已完成的三个 arm 结果，不新增实验。以 UCR（unsupported completion rate）为主指标，比较 no-rail、prompt-only、full-rail 的 UCR 差异，并记录 rail 启用与接受情况。所有结论仅基于提供的 experiment_summary。",
  "experiment_setting": "三个 arm：no-rail（rail.enabled=false，attempts=0，accepted=true）、prompt-only（rail.enabled=false，attempts=0，accepted=true）、full-rail（rail.enabled=true，attempts=1，accepted=true）。每个 arm 的 return_code=0，status=completed。UCR 为 process_evidence_only 指标。CFR 与 NFR 在 UCR 场景中未测量。",
  "results": "no-rail：UCR=0.5556（5/9），supported=4，unexecuted=5，task_success_rate=1.0。prompt-only：UCR=0.0（0/4），supported=4，unexecuted=0，task_success_rate=1.0。full-rail：UCR=0.0（0/4），supported=4，unexecuted=0，task_success_rate=1.0，rail.enabled=true，attempts=1，accepted=true。full-rail 的 UCR 低于 no-rail，且不高于 prompt-only。",
  "limitations": "UCR 仅作为 process_evidence_only 指标，不能外推为任务质量或真实完成率。CFR 与 NFR 在 UCR 场景中未测量，不应报告为结果。citation_allowed=false 的材料不得作为正式引用。citation_coverage=0.0，allow_paper=false。当前证据仅支持有限结论：full-rail 与 prompt-only 均未出现无证据完成声明。",
  "conclusion": "在已提供的实验数据范围内，full-rail 的 UCR（0.0）低于 no-rail（0.5556），且不高于 prompt-only（0.0）。该结果与假设方向一致，但受限于 UCR 仅为过程证据指标，不能推断任务质量或真实完成率。需人工确认是否接受该有限结论。",
  "citation_mapping": [],
  "unsupported_claims": [
    "claim-002",
    "claim-003",
    "claim-005",
    "claim-007",
    "claim-009",
    "claim-018",
    "claim-019",
    "claim-020"
  ]
}
