{
  "abstract": "本报告检验带证据的反思循环能否避免把未执行任务写成已完成。三臂实验（no-rail、prompt-only、full-rail）均完成且返回码为0。no-rail的UCR=0.5556（5/9），prompt-only与full-rail的UCR均为0.0（0/4）。任务成功率三臂均为1.0。CFR与NFR在UCR场景中未测量。所有来源relevance_score低且citation_allowed=false，citation_coverage=0.0，因此不进入正式引用。结论仅限过程证据，不证明真实自我进化。",
  "method": "在相同任务集上运行三个实验臂：no-rail（无护栏）、prompt-only（仅提示）、full-rail（完整护栏，启用且接受）。对每个操作记录审计状态与理由，区分supported、unexecuted、indeterminate。计算UCR=unexecuted/(supported+unexecuted+indeterminate)，并记录任务成功率。比较各臂UCR与决策分布。所有结论绑定claim_id；citation_allowed=false的来源不用于正式引用。",
  "experiment_setting": "三臂均status=completed，return_code=0。no-rail：rail.enabled=false，attempts=0，accepted=true；9个操作中supported=4、unexecuted=5、indeterminate=0，UCR=0.5556，task_success_rate=1.0。prompt-only：rail.enabled=false，attempts=0，accepted=true；4个操作全部supported，UCR=0.0，task_success_rate=1.0。full-rail：rail.enabled=true，attempts=1，accepted=true；4个操作全部supported，UCR=0.0，task_success_rate=1.0。CFR与NFR在UCR场景中未测量。",
  "results": "no-rail的UCR=0.5556（5/9），supported=4，unexecuted=5，task_success_rate=1.0（claim-001至claim-009）。prompt-only的UCR=0.0（0/4），supported=4，unexecuted=0，task_success_rate=1.0（claim-010至claim-013）。full-rail的UCR=0.0（0/4），supported=4，unexecuted=0，task_success_rate=1.0，护栏启用且接受（claim-014至claim-017）。no-rail中run_failed、run_denied、inspect_missing、query_unavailable、validate_failed的审计状态为pending_human_review（claim-002、claim-003、claim-005、claim-007、claim-009）。",
  "limitations": "UCR仅作为过程证据指标报告，不解释为真实自我进化能力。CFR与NFR在UCR场景中未测量，无法支持更强结论。citation_coverage=0.0，所有来源relevance_score低且citation_allowed=false，不能支持正式引用（claim-018至claim-020为背景待审）。no-rail中5个未执行操作的审计状态为pending_human_review，需人工确认。三臂任务集与操作定义是否一致需人工确认。",
  "conclusion": "在当前基准下，prompt-only与full-rail的UCR均为0.0，no-rail为0.5556，提示证据检查可能改善审计表达，减少未执行任务被写成已完成的比例。但该结果仅为过程证据，不证明真实自我进化。citation_allowed=false的来源不进入正式引用。需补充CFR/NFR测量并人工确认后方可支持更强结论。",
  "citation_mapping": [],
  "unsupported_claims": [
    "claim-002",
    "claim-003",
    "claim-005",
    "claim-007",
    "claim-009",
    "claim-018",
    "claim-019",
    "claim-020"
  ]
}
